{"engine_semantics_version":"0.4.0-next_open_basket","generated_at":"1970-01-01T00:00:00+08:00","orders":[{"bare_code":"518880","basket_id":null,"direction":"buy","event_date":"2026-01-06","filled_price":13.46,"filled_shares":2400,"momentum_score":1.6441951509454074,"order_reason":null,"order_seq":1,"order_status":"filled","qmt_code":"518880.SH","requested_shares":null,"requested_value":33333.333333,"trading_date":"2026-01-07","trigger_reason":"rotation_buy"},{"bare_code":"513880","basket_id":null,"direction":"buy","event_date":"2026-01-06","filled_price":13.469,"filled_shares":2400,"momentum_score":1.6423962257060203,"order_reason":null,"order_seq":2,"order_status":"filled","qmt_code":"513880.SH","requested_shares":null,"requested_value":33333.333333,"trading_date":"2026-01-07","trigger_reason":"rotation_buy"},{"bare_code":"159915","basket_id":null,"direction":"buy","event_date":"2026-01-06","filled_price":13.47,"filled_shares":2400,"momentum_score":1.6421965761187853,"order_reason":null,"order_seq":3,"order_status":"filled","qmt_code":"159915.SZ","requested_shares":null,"requested_value":33333.333333,"trading_date":"2026-01-07","trigger_reason":"rotation_buy"}],"schema_version":"1.0","source_digest_ref":"7f662b42ad18f9be855e4796c313b348c55527fc456c3e6c6fae6501e37b6fbe","strategy_id":"etf_regression_rotation_v1","timezone":"Asia/Shanghai","trigger_reason_taxonomy":["defensive_buy","defensive_clear","no_candidate_clear","rotation_buy","rotation_exit","stop_loss","volume_surge"]}